date,text,Compound,Positive,Negative,Neutral
2021-02-19,"Cryptocurrency exchange giant Binance has just announced its latest Launchpool yield farming incentive for DODO, a Chinese-based decentralized exchange running on Binance Smart Chain. According to the announcement, the seventeenth project on Binance's crypto incubator platform will be open for yield farming for 14 days, beginning on Feb. 19.",0.6369,0.102,0.0,0.898
2021-02-19,"Ethereum traded to yet another all-time high at $1,950 against the US Dollar. ETH price is correcting gains, but it is likely to remain strong above $1,900 and $1,880.",0.7311,0.186,0.0,0.814
2021-02-19,"Looks like Binance Coin (BNB) is all set to eat into the market share of Ethereum (ETH)! Binance coin (BNB), the native cryptocurrency of the Binance Smart Chain has entered an indomitable price rally over the last few days.",0.7712,0.176,0.0,0.824
2021-02-19,"Crypto influencer and trader Elliot Wainman is bullish on a low-cap altcoin that is combining the advantages of decentralized finance (DeFi) and non-fungible tokens (NFTs). In a new YouTube video, the trader tells his 260,000 subscribers that KIRA Network (KEX) has the potential to grow exponentially as the DeFi and NFT sectors continue to gain […] The post Crypto Trader Elliot Wainman Says This Low-Cap Crypto Asset Built on Ethereum Could Be the Next Big Moonshot appeared first on The Daily Hodl.",0.8126,0.098,0.0,0.902
2021-02-19,Bitcoin and Ethereum continue to set new records as Binance Coin has leaps into the top 3 currencies by market cap.,0.2023,0.087,0.0,0.913
2021-02-19,"While XRP (XRP) is trading in a range without confirming a trend, ICON (ICX) and Dash (DASH) are looking bullish. Both are expected to reach their respective long-term resistance areas.",0.4404,0.13,0.0,0.87
2021-02-19,"Ethereum (ETH/USD) expanded recent gains early in today's North American session as the pair appreciated to the 1938.85 area after trading as low as the 1890 area during the Asian session, with the intraday low a pullback from the recent multi-year high around the 1951.99 area.  Stops were elected above a major upside price objective around the 1930.40 level, an area related to buying pressure that originated around the 215.16 area.",-0.0772,0.074,0.104,0.821
2021-02-19,"Ethereum price has soared to a new all-time high of $1,950, however, the mounting gas fee on the network has made many defi protocols barely usable. Defi ecosystem that works on top of the Ethereum network is one it the biggest success story from crypto last year and it has continued its boom in 2021 The post Is Ethereum (ETH) Losing the DeFi Battle Against Binance Smart Chain (BSC) appeared first on Coingape.",0.4588,0.102,0.065,0.833
2021-02-19,Binance has temporarily suspended Ethereum withdrawals due to congestion,-0.4767,0.0,0.279,0.721
2021-02-19,"Ethereum's price has been rising steadily since the start of February, with ETH closing in on the $2000-mark, at press time. However, every time the market moves steadily in the bullish direction, traders are keen on knowing whether a price correction will set in once the said momentum fades.",0.3612,0.051,0.0,0.949
2021-02-19,"Since the beginning of 2021, Ethereum price has been on a healthy uptrend. Many projects using ERC-20 have seen tremendous success in their launch, and the DeFi market was pushed to the mainstream just as planned.",0.7506,0.162,0.0,0.838
2021-02-19,Miami Mayor Francis Suarez will invest his own cash into cryptocurrency this week and is choosing between three coins.,0.0,0.0,0.0,1.0
2021-02-19,Binance has temporarily suspended Ethereum and ERC-20 withdrawals citing a network congestion issue behind the decision. Ethereum network has been reeling with scalability and rising gas fee issues despite its market price reaching new all-time-highs.,-0.3182,0.049,0.084,0.867
2021-02-19,"Crypto exchange Binance resumed withdrawals of Ether on its platform after the leading exchange temporarily suspended withdrawals of Ether and Ethereum-based tokens, in order to “address a congestion issue.”  At the time, the exchange, which recorded over 33 billion in volume in the last 24 hours said on Twitter that funds were “SAFU.",-0.4767,0.0,0.057,0.943
2021-02-19,"It is safe to say that Ethereum is no longer playing second fiddle to Bitcoin. While there might be a massive difference between their market capitalizations, the community engagement is almost similar, with Ethereum taking the center-stage sometimes too.",0.6705,0.175,0.05,0.774
2021-02-19,Traders are seemingly expecting Ethereum to continue to rack up gains against Bitcoin. The post Why traders say Ethereum will continue to outperform Bitcoin in the short-term appeared first on CryptoSlate.,0.34,0.074,0.0,0.926
2021-02-19,"Binance paused ERC-20 withdrawals without offering a credible explanation, letting speculation about its true motives run wild.",0.4215,0.157,0.0,0.843
2021-02-19,"However, some traders insist that the platform had stopped withdrawing ETH at least an hour before the announcement was actually made.  Conspiracy Theories Anyone?",-0.6486,0.0,0.194,0.806
2021-02-19,It's safe to say that the past 7 days were particularly intense on the cryptocurrency market. The cryptocurrency that expanded the most out of the large-caps is Binance Coin (BNB) as it surged by a whopping 150% in a week.,0.5413,0.114,0.0,0.886
2021-02-19,Bitcoin's rally to a $1 trillion market cap could attract more buyers to the crypto sector and boost the price of several altcoins.,0.6369,0.206,0.0,0.794
2021-02-20,Ether has more than doubled in price since the beginning of the year.,0.0,0.0,0.0,1.0
2021-02-20,"The price rally has pushed Ethereum's market capitalization to above $225 billion, up 30% since early February. The post ETH price tops $2,000 for the first time to hit new all-time high appeared first on The Block.",0.1027,0.08,0.07,0.85
2021-02-20,"In what is yet another crucial milestone for Ethereum, the world's largest altcoin, ETH has now breached the much-anticipated $2000-level across major crypto-exchanges. Interestingly, last week, Ethereum's market cap also crossed the $200 billion dollar mark.",0.4019,0.072,0.0,0.928
2021-02-20,The chipmaker was overwhelmed by the massive use of its graphic chips by Ethereum and Bitcoin miners in 2017. The post Nvidia bets big on Ethereum mining with new dedicated graphic chip appeared first on CryptoSlate.,0.4939,0.11,0.0,0.89
2021-02-20,"The world's second-largest cryptocurrency Ethereum (ETH) has surged all the way to above $2000 levels hitting its new all-time high. At press time, ETH is trading 5.68% up at a price of $2030 with a market cap of $232 billion.",0.0,0.0,0.0,1.0
2021-02-20,"At the time of writing, ETH/USD is changing hands at $2,000, having gained over 5% in the past 24 hours and over 200% since the start of the year. Ethereum's market capitalization surpassed $230 billion, while an average daily trading volume exceeded $40 billion.",0.3818,0.057,0.0,0.943
2021-02-20,"The two largest cryptoassets, bitcoin (BTC) and ethereum (ETH), are on their journey of discovering new all-time highs. Despite its recent high fees-caused problems that helped competitors grow, ETH surpassed USD 2,000 today for the first time, while BTC, which is still a USD 1trn asset, rallied above USD 56,000. At the time of writing (07:10 UTC), ETH trades at USD",-0.0516,0.04,0.043,0.918
2021-02-20,"Ethereum has broken a key psychological resistance barrier at $2,000.  Ethereum on a Rally  ETH has crossed $2,000 for the first time.",-0.5574,0.0,0.204,0.796
2021-02-20,"The second-largest cryptocurrency by market cap, Ethereum, has broken above another milestone by taking down the $2,000 price tag.",-0.4767,0.0,0.147,0.853
2021-02-20,"Ethereum climbed past $2000 a few hours at the start of the day. The $1950 mark was a technical target for Etheruem following its breakout past $$1420, and although it took some time, Ether finally made it.",0.0,0.0,0.0,1.0
2021-02-20,"Thanks to Bitcoin's overwhelming market dominance and market share, its movement is often reflected in the performances of the market's altcoins. When the world's largest crypto was rangebound and consolidating, market alts such as Monero and Ethereum Classic corrected.",0.7096,0.161,0.0,0.839
2021-02-20,"Ethereum (ETH/USD) extended recent upside gains early in today's North American session as the pair appreciated to the 2036.77 area after trading as low as the 1925.03 area during the Asian session, with the intraday low representing a test of the 50-hour simple moving average.  The pair peaked around the 2041.42 area during the Asian session, a fresh all-time high.",0.5859,0.123,0.064,0.813
2021-02-20,"With a charity and some slapdash art theory as a cover, a copycat makes off with 512 ETH in NFT sales",0.4215,0.141,0.0,0.859
2021-02-20,Will the correction of the top coins arrive soon?,0.2023,0.184,0.0,0.816
2021-02-20,"While Musk said Schiff ""might as well"" have crypto in lieu of gold deposit statements, he did warn that digital currency valuations may be running hot",0.1779,0.076,0.051,0.873
2021-02-20,"The Pair in Charge First-mover Bitcoin (BTC) took its first-place rank in the cryptocurrency market seriously today, setting a new all-time high of $57,851.30 just hours ago. BTC now has a market capitalization of $1.063 trillion, another record high.",-0.1779,0.0,0.045,0.955
2021-02-20,"Ether price is attempting to conquer $2,000 as the Ethereum blockchain is seeing increasing demand.",-0.128,0.0,0.097,0.903
2021-02-20,"A prominent trader who built his following after accurately nailing Bitcoin's collapse to $4,000 in March 2020 says that Ethereum (ETH) and Binance Coin (BNB) are primed to outshine Bitcoin in the coming months. In a new tweet, the analyst known in the industry as Capo says that while BTC is grabbing headlines, his money […] The post Top Trader Expects Ethereum and Binance Coin To Outperform Bitcoin, Names Four Crypto Assets Poised for Explosive Runs appeared first on The Daily Hodl.",0.3818,0.091,0.037,0.872
2021-02-21,"Ethereum traded to a new all-time high near $2,040 before correcting lower against the US Dollar. ETH price is trading nicely above $1,850 and it is likely to continue towards $2,000.",0.1779,0.088,0.066,0.846
2021-02-21,BTC charted yet another dip finding support around $54K. ETH dropped below $2000 while UNI has broken above $32 for a new ATH.,-0.1027,0.105,0.12,0.775
2021-02-21,"Ethereum saw some selling pressure that forced it back beneath $2000. Uniswap showed that its bullish momentum had weakened in the short-term, and Dogecoin has halted its slow descent and found a level of support.",-0.5859,0.067,0.187,0.746
2021-02-21,"The second-biggest cryptocurrency is only the fourth-ranked staking network, but it's looking to catch up to the rest.",0.0,0.0,0.0,1.0
2021-02-21,"Ethereum (ETH/USD) was weaker early in today's North American session as the pair depreciated to the 1937.59 area after trading as high as the 1975 area during the European session.  Traders drove ETH/USD as low as the 1811.25 level during the Asian session, representing a test of the 23.6% retracement of the appreciating range from 1039.62 to 2041.42.",-0.2732,0.047,0.081,0.872
2021-02-21,Ethereum registered a new ATH at $2000 yesterday and at the time of writing has dipped slightly on the price charts. The price is up by over 5 % in the past 24 hours and over 12.5% in the past week and the recent price action is making retail traders ask if this is Ethereum's […],0.0,0.0,0.0,1.0
2021-02-21,Altcoins continue to chart serious gains. Many of them see subsequent all-time highs almost daily.,0.2732,0.144,0.078,0.778
2021-02-21,The rise of Binance Coin (BNB) has taken the crypto industry by surprise but it has also led to the emergence of another influential blockchain in the ecosystem. Binance Smart Chart or BSC is currently making the industry take notice and as evidenced demonstrates a clear increase in demand.,0.9267,0.259,0.03,0.711
2021-02-21,"Using multi-leg options can give traders a less risky way to invest in Ethereum price as it pushes above $2,000.",-0.1298,0.0,0.077,0.923
2021-02-22,"Ethereum failed to stay above $1,900 and corrected lower against the US Dollar. ETH price is correcting gains and it seems like to might test $1,750 before a fresh increase.",0.4588,0.25,0.145,0.605
2021-02-22,"Bitcoin price remained strong and it extended its rally above USD 58,000. BTC even traded to yet another all-time high near USD 58,641 (per Coingecko.com) before it started a downside correction. It is currently (05:00 UTC) trading below USD 57,000, with key supports at USD 55,000 and USD 52,000. Similarly, there were corrective moves in most major altcoin. ETH/USD failed to continue higher above",0.128,0.083,0.076,0.842
2021-02-22,"Ethereum Improvement Proposal (EIP) 1559 has been the most talked-about upgrade for the network since ETH 2.0 was launched on Dec. 1, 2020. The EIP tackles the debilitating problem of high transaction fees which have strained the network in recent months.",-0.2263,0.096,0.115,0.789
2021-02-22,"Many coins in the altcoin market endured pull-backs with Ethereum facing some resistance at $2000 and were unable to hold on to the $1915 price level as well. Ontology dropped sharply beneath the $1.4 mark, and BitTorrent token rose toward a level of resistance at $0.02.",0.2732,0.046,0.0,0.954
2021-02-22,"Nvidia announced that it will start limiting the efficiency of mining ethereum or any other crypto using its new range of upcoming graphics processing units (GPUs). In a blog post published Feb. 19, the U.S. hardware maker said this limitation will feature first on its new Geforce RTX 3060 card, which is scheduled for release […]",0.0,0.043,0.043,0.914
2021-02-22,"Price of second cryptocurrency has been brutally rejected from marvelous $2,000 level. Meanwhile, all fundamentals remain healthy, analysts claim",-0.1779,0.228,0.253,0.519
2021-02-22,Ethereum dropped by a steep 10% today as it slipped below $1800. The coin is also struggling against Bitcoin as it reached the monthly low.,-0.5423,0.051,0.179,0.769
2021-02-22,"Ethereum (ETH/USD) extended its pullback early in today's North American session as the pair depreciated to the 1748 area after trading as high as the 1940.54 area during the Asian session, down from the recent lifetime high of 2041.42.  The intraday low represented a test of the 23.6% retracement of the recent depreciating range from 1836 to 1725.",-0.2732,0.0,0.036,0.964
2021-02-22,"Polkadot showed signs of bearishness in the short-term and could dip beneath the $38 level once more. Tron showed that its previous bullish momentum had weakened, and Ethereum Classic was in a phase of consolidation over the past few days.",-0.3182,0.0,0.057,0.943
2021-02-22,"The recent ramp higher in cryptocurrency prices has assuredly attracted its fair share of cheerleaders and detractors alike, but the reality of this climb has been a concurrent increase in network fees from rising transaction volumes. Binance is Blamed for Purposely Choking Ethereum's Network to Drive More Users to Its Own Platform The resulting volumes […]",-0.1655,0.173,0.122,0.705
2021-02-22,"Data collected by The Block Research shows that, for the first time, Ethereum miners have brought in more than $1 billion in revenue for the month of February. That includes approximately $541 million in the form of transaction fees, which miners earn with every new block they successfully create. The fee income has been buoyed […] The post Ethereum mining's monthly revenue reaches all time high over $1 billion in February appeared first on The Block.",-0.4939,0.076,0.102,0.822
2021-02-22,"Since the first phase of the bullish rally in 2020, Bitcoin and Ethereum have been struggling with each other to re-instate a bullish dominance in the market. Ethereum has often rallied on its own when BTC stagnated a little but Bitcoin managed to breach its previous all-time high before Ethereum did.",-0.128,0.028,0.038,0.934
2021-02-22,Can Ethereum (ETH) withstand the fall of Bitcoin (BTC)?,0.0,0.0,0.0,1.0
2021-02-22,"Bitcoin price crashed by 13% to trade under $50,000 registering a daily low of $48,900. The price volatility is being attributed to the upcoming expiration of nearly $3 billion worth of Bitcoin Options this Friday.",-0.0516,0.053,0.058,0.889
2021-02-22,"The Kraken exchange order book saw ETH tank below $750, around $1,000 less than the true market value earlier today. Following the event, gas prices soared to 1,000 gwei for a fast transaction.",0.6041,0.141,0.0,0.859
2021-02-22,"An analyst who anticipated a significant crypto correction in February is mapping out his key price levels for the top two digital assets by market cap. In a new strategy session, Michaël van de Poppe highlights the fact that Bitcoin has historically witnessed red candles in February and March, with significant pullbacks unfolding this time […] The post As Bitcoin and Ethereum Tumble, Analyst Who Predicted Crypto Correction Plots Path Ahead appeared first on The Daily Hodl.",0.6249,0.091,0.0,0.909
2021-02-22,"The price of ETH flash-crashed to a low of $700 on the popular US-based cryptocurrency exchange, Kraken.",0.1779,0.148,0.111,0.741
2021-02-22,"Ethereum fell Monday in sync with the cryptocurrency market's other top assets, including Bitcoin, Binance Coin, Polkadot, and Cardano. The second-largest cryptocurrency touched a record high of $2,041 during the weekend session that prompted daytraders to secure their profits.",0.7783,0.206,0.0,0.794
2021-02-22,Average Ethereum (ETH) transaction fees have surged to new highs as the crypto market takes a dive.,0.0,0.0,0.0,1.0
2021-02-22,"Bitcoin (BTC) and ETH have paired back gains from impressive rallies the previous week. However, sellers were out in force to start the week, pushing the top two cryptocurrencies by market cap into the red by more than 15% at one point.",0.7579,0.161,0.0,0.839
2021-02-22,"Muneeb Ali, Co-founder of Stacks, joins ""First Mover"" to discuss his new venture Hiro, which aims to enable apps, smart contracts, and digital assets on the Bitcoin network. Ali also shares his thoughts on the future of global crypto adoption and BTC's meteoric rise.",0.6808,0.139,0.0,0.861
2021-02-22,"Billionaire entrepreneur Elon Musk is looking at both gold and crypto and their functions as means of exchange. In response to gold bug and outspoken Bitcoin critic Peter Schiff's latest tirade against the leading crypto asset, Musk highlights his view that money is just another form of data that serves the purpose of facilitating transactions. […] The post Elon Musk Compares Crypto to Gold, Says Prices of Bitcoin and Ethereum Seem High appeared first on The Daily Hodl.",0.1027,0.031,0.026,0.943
2021-02-22,"Since January, the price of Ethereum has been trading with sudden highs and lows, leaving some traders waiting for markets to settle. After Ether dropped roughly 12% after its 20 February ATH of $2,042.93, the asset was trading at $1,790.94, at press time.",0.1779,0.055,0.04,0.905
2021-02-22,"The robots are no more, and Lindsay Lohan is cashing in.",-0.296,0.0,0.18,0.82
2021-02-22,"For the last six years, Ethereum has dominated the smart contract landscape and has been arguably the only viable platform for launching decentralized applications (dApps) — due to its sizeable developer community and first-mover advantage. But in the last year, Ethereum's limitations have begun to show, leading to an exodus of sorts among its once fervent developer community.",0.5859,0.11,0.032,0.858
2021-02-22,"As gas fees on the Ethereum smart contract platform soar, popular crypto influencer Lark Davis is calling on Ethereum co-founder Vitalik Buterin to finally roll out Ethereum 2.0. In a new video, Davis tells his 218,000 subscribers that while he is bullish on Ethereum (ETH), the transaction fees on the smart contract platform have become […] The post Lark Davis Urges Launch of Ethereum 2.0 Amid ‘Crazy' Fees, Exodus to Binance Smart Chain appeared first on The Daily Hodl.",0.872,0.128,0.0,0.872
2021-02-22,"Bitcoin and ether prices retreat after reaching record highs over the weekend. ""The Hash"" panel weighs in on the asset's historic volatility and whether wild price swings are here to stay.",0.3818,0.11,0.0,0.89
2021-02-22,"Ethereum transaction fees, called ""gas fees,"" have been rising along with ETH's value, hitting an all-time-high. ""The Hash"" team discusses what spillover impact this is having on DeFi products.",0.34,0.079,0.0,0.921
2021-02-22,"Bitcoin and altcoins both saw a strong bounce off their intraday lows, which signals that traders still view dips as buying opportunities.",0.6249,0.23,0.07,0.7
2021-02-23,"The rollercoaster-ride in cryptocurrency prices on Monday was accompanied by Binance's fresh restrictions for ethereum and ERC-20 tokens. Ethereum Network Congestion Fingered as the Culprit for the Temporary Halt Through the official Binance Twitter account, one of the world's largest cryptocurrency exchanges by volume, announced that it had “temporarily suspended withdrawals of $ETH and ethereum-based […]",-0.2023,0.039,0.052,0.909
2021-02-23,"Ethereum (ETH/USD) glided lower in today's Asian session as the pair depreciated to the 1655 area after trading as high as the 1805.03 area earlier during the Asian session, with the intraday high representing a test of the 100-bar 4-hour simple moving average.  Traders knocked ETH/USD lower to the 1507.34 level early in the week, a move that saw a test of the 61.8% retracement level of the recent appreciating range from 1206.05 to 2041.42.",-0.128,0.038,0.058,0.904
2021-02-23,"Crypto YouTuber Lark Davis is urging Ethereum's to launch ETH 2.0 quickly, warning its devs must act soon to prevent rival networks from taking over amid high gas fees.",-0.3182,0.036,0.079,0.885
2021-02-23,"Ethereum has lost several support levels since the rejection from the all-time high of $1,940. Support at the 200 SMA is expected to prevent extended losses toward $1,500.",-0.4588,0.176,0.23,0.595
2021-02-23,"Ethereum started a sharp decline below $1,850 against the US Dollar. ETH price spiked towards $1,500 and it is currently struggling to stay above $1,650.",-0.4215,0.0,0.109,0.891
2021-02-23,"Ripple remained stable above $0.5000, while there were heavy losses in bitcoin and ethereum against the US Dollar. XRP price is likely to start a fresh increase above $0.5500.",0.4767,0.203,0.081,0.716
2021-02-23,"The entire ethos of cryptocurrency and DeFi is to gain distance and freedom from centralized banks and corporations. However, these virtues appear to have been lost at the moment as Ethereum fees are driving users to centralized providers such as Binance.",0.8316,0.204,0.047,0.749
2021-02-23,"Amid the marketwide bloodbath, the world's second-largest cryptocurrency Ethereum (ETH) has tanked over 16% with its price slipping below $1600 levels. Two days back on Sunday, February 21, ETH price surged past $2000 levels.",0.0,0.0,0.0,1.0
2021-02-23,The biggest Ethereum wallets are smart contracts instead of exchange or user accounts—a sign of adoption and activity. The post Top two Ethereum addresses lock up $17 billion in smart contracts appeared first on CryptoSlate.,0.7351,0.184,0.0,0.816
2021-02-23,"This makes for the second time in the past week that Binance has suspended its Ethereum withdrawals. A similar incident occurred on Feb 19, where Binance also suspended ETH and ERC-20 withdrawals, also citing “network congestion” as the reason.",-0.7351,0.0,0.147,0.853
2021-02-23,"Ethereum tanked wildly in the running weekly session, shedding up to 30 percent of its valuation in just two days of trading amid a broader cryptocurrency market correction. The plunge in the second-largest crypto brought its prices down to a multi-week low of $1,356, prompting bears to envision further declines after the asset's 176 percent […]",-0.2732,0.0,0.038,0.962
2021-02-23,"After rebranding from Matic Network, the Ethereum scaling solution is implementing Chainlink's Verifiable Random Function capabilities.",0.3182,0.133,0.0,0.867
2021-02-23,"The average transaction costs paid on the Ethereum network have skyrocketed above $30 to a new ATH, while ETH's price dropped by $700 in days.",0.0,0.0,0.0,1.0
2021-02-23,"Ethereum has seen immense volatility over the past two days as the bullish trend has finally begun to slow. It began early this past weekend, which was when the leading cryptocurrency began to slam lower as Bitcoin fell from its highs in the $58,000 range.",-0.5859,0.0,0.1,0.9
2021-02-23,Can Ethereum (ETH) and XRP recover faster than Bitcoin (BTC)?,0.0,0.0,0.0,1.0
2021-02-23,"Jesse Powell, CEO of Kraken. Source: a screenshot, Instagram/krakenfx “Extreme” ethereum (ETH) selling caused yesterday's flash crash to USD 700 on Kraken, according to Jesse Powell, CEO and Co-founder of the crypto exchange giant. The CEO was speaking to Bloomberg TV, and claimed that his firm was “in the process of investigating” the incident. However, Powell claimed, “There",-0.4019,0.0,0.046,0.954
2021-02-23,"Losses registered by the likes of Bitcoin and Ethereum erased nearly $150 billion from the entire crypto-market in the last 24 hours alone. While the king coin fell below the $50k price level, ETH dropped under the $1,500-mark.",-0.2263,0.066,0.111,0.824
2021-02-23,"The spotlight shed on Bitcoin has only gotten brighter over the past couple of years. And yet, Ethereum has managed to stand tall beside it too.",0.3818,0.094,0.0,0.906
2021-02-23,"The recent cryptocurrency market crash had a big impact on the overall market cap, which lost around 150 billion within 24 hours. This comes after an anticipated Tweet from Elon Musk disowning Bitcoin.",-0.6124,0.0,0.143,0.857
