date,text,Compound,Positive,Negative,Neutral
2021-01-28,"Crypto venture capitalist Spencer Noon is forecasting an Ethereum rally that will launch the asset well above its new all-time high. The general partner at crypto venture capitalist firm Variant says that the number of users and the amount of capital deployed in decentralized finance (DeFi), which Noon calls Ethereum's “biggest use case,” is a […] The post Ethereum Poised To Blow Past All-Time High With DeFi on Parabolic Uptrend, Says VC Investor Spencer Noon appeared first on The Daily Hodl.",0.7096,0.094,0.0,0.906
2021-01-28,This resulted from the exploitation of a system flaw leading to a successful hack. The perpetrator made off with part of the platform's fees for the day.,0.1531,0.127,0.107,0.767
2021-01-29,"Virgil Griffith, a crypto developer accused of helping North Korea evade sanctions through speaking at a Pyongyang crypto conference in 2019, must now face a jury.",0.0,0.087,0.087,0.827
2021-01-29,"Ethereum resumes the uptrend following support at $1,200. Ether keeps investor interest at the peak with price projections between $1,500 and $3,000 in the near term.",0.6908,0.192,0.0,0.808
2021-01-29,"Ethereum gained pace above the $1,300 level against the US Dollar, but it struggled near $1,375. ETH price is approaching a major support and it is likely to bounce back above $1,350.",0.3071,0.147,0.085,0.768
2021-01-29,"Soulja Boy, who has started investing into cryptocurrency, can now participate more easily in the Ethereum ecosystem.",0.4005,0.144,0.0,0.856
2021-01-29,"Disclaimer: The findings of the following analysis are the sole opinions of the writer and should not be taken as investment advice Ethereum was valued at around $1,300 at press time, after dropping by 11% from its all-time high [ATH] of $1,476 on 25 January. Interestingly, the world's largest altcoin might be due for more downward […]",0.6808,0.092,0.0,0.908
2021-01-29,"With Ethereum working towards transitioning to a complete PoS Layer 2 network, many in the community are concerned about when mass adoption may be incoming. This question was recently answered by Anthony Sassano, Founder of The Daily Gwei, during a recent interview when he said that it will be “soon incoming.",0.0,0.0,0.0,1.0
2021-01-29,Ethereum (ETH/USD) made huge gains early in today's North American session as the pair appreciated to the 1432.00 area after trading as low as the.,0.7096,0.257,0.068,0.675
2021-01-29,Layer-2 blockchain Cartesi has launched Optimistic Rollups that will allow developers to build scalable Ethereum applications. Cartesi Adopts Optimistic Rollups  Cartesi (CTSI) is a Layer-2 chain that began in 2018 as a Binance Launchpad project.,0.7717,0.257,0.0,0.743
2021-01-29,"Ethereum's price, at press time, was hovering around the $1,300-level, with the altcoin under a lot of selling pressure since hitting the $1,472-level. At the time, the altcoin was 11.6% below its ATH, with the market capitalization dropping to under $150 billion.",-0.296,0.0,0.052,0.948
2021-01-29,"Ethereum saw a massive breakout rally today that came about alongside Bitcoin BTC's surge from $32,000 to highs of $38,500 came about as the result of Elon Musk changing his Twitter bio to “#Bitcoin” and calling the change “inevitable” in hindsight This dragged all the major altcoins higher, but the focus remains on Bitcoin for […]",-0.0258,0.0,0.02,0.98
2021-01-29,"Bitcoin Bitcoin is up by a cool 20% over the past week as it currently trades near the $35,700 handle. The number 1 ranked cryptocurrency had been trapped within a range for the majority of the week as it oscillated between $33,000 and $30,000.",-0.2023,0.08,0.076,0.844
2021-01-29,"In 2021, we're likely to see a lot of crypto industry players adopt sidechains and parachains to provide a better experience for their users.",0.5574,0.187,0.0,0.813
2021-01-29,Gold bug money manager Frank Holmes of US Global Investors lays out his volatility ranges for Bitcoin and Ethereum in 2021. He also explains how he believes Bitcoin's value could evolve if its price reaches $300K-$400K.,0.3818,0.096,0.0,0.904
2021-01-29,$80K Bitcoin and $3K Ethereum are within US Global Investors CEO Frank Holmes' volatility range for 2021. He also sees $400K Bitcoin on the cards after the next 3-4 years.,0.0,0.0,0.0,1.0
2021-01-29,"Bitcoin's surprise rally to $38,500 lifted sentiment across the market but the temporary boost appears to be losing steam.",0.1779,0.208,0.139,0.653
2021-01-29,"Today was a wild day for the cryptocurrency market after Dogecoin had a massive 1,000% breakout thanks to the WallStreetBets subreddit. This group has been notorious for making 'YOLO' bets on stocks and recently made a group effort to boost the price of GameStop's stock as a big hedge fund had shorted it significantly.",0.4019,0.101,0.052,0.847
2021-01-30,"Ethereum just logged 26 straight days with a closing price above $1,000.",0.2263,0.16,0.0,0.84
2021-01-30,"Grayscale, one of the world's largest digital asset managers, has reopened its Ethereum trust to investors. At 4 PM EST, an announcement confirmed that the Grayscale Ethereum Trust had resumed the private placement of its shares.",0.8834,0.267,0.0,0.733
2021-01-30,"The leading digital asset manager, Grayscale Investments, has resumed the private placement shares for its SEC-reporting Ethereum Trust.",0.7906,0.348,0.0,0.652
2021-01-30,Can Bitcoin (BTC) keep up with the growth of popular altcoins?,0.6597,0.375,0.0,0.625
2021-01-30,The world's biggest crypto asset management firm may be preparing to give its clients more products in which to invest.,0.3612,0.116,0.0,0.884
2021-01-30,"The former Ethereum Foundation developer, Virgil Griffith, has been accused of violating the International Emergency Economic Powers Act in North Korea. Prosecutors believe his actions.",-0.8074,0.0,0.274,0.726
2021-01-30,Ethereum (ETH/USD) moved higher early in today's North American session as the pair appreciated to the 1380.96 area after trading as low as the 1327.,0.296,0.116,0.074,0.81
2021-01-30,"Thanks to Bitcoin's dominance and overwhelming market share, most altcoin movements are correlated to the fortunes of the world's largest cryptocurrency. At press time Bitcoin was trading at $33,739 with a 24-hour trading volume of $82.8 billion.",0.7096,0.173,0.0,0.827
2021-01-30,"Reddit is partnering with the Ethereum Foundation in an effort to boost Ethereum scaling efforts. Reddit, which is one of the largest social media projects in the world and whose platform is currently in the spotlight as its users band together to take on Wall Street, is extending its partnership with the Ethereum Foundation in […] The post Ethereum Foundation To Launch ‘Large Scale' Applications on Reddit appeared first on The Daily Hodl.",0.4019,0.036,0.0,0.964
2021-01-30,"Ethereum has been largely tracking Bitcoin's price action as of late, but its swings have been far more tempered as it hovers within the $1,300 region The cryptocurrency has been showing some signs of strength, with bulls ardently absorbing all the intense sell pressure it has faced in recent times This indicates that there's a […]",0.4497,0.095,0.046,0.859
2021-01-31,"Ethereum remains in a range above the $1,300 support against the US Dollar. ETH price is likely to gain momentum above $1,400 and $1,450 resistance levels in the near term.",0.7269,0.184,0.0,0.816
2021-01-31,"Even though Bitcoin moved closer to the $34,000 level and saw some positive movement on the charts, some altcoins remained cautious and awaited stronger cues for a more definitive move. Such was the case with ETH and TRX, both of which were moving sideways at the time of writing.",0.6908,0.118,0.047,0.835
2021-01-31,"Widely-followed crypto strategist and trader Michaël van de Poppe is revealing his bull market predictions for Bitcoin, Ethereum, and six other crypto assets. In a new tweet, Van de Poppe tells his 114,700 followers that he sees Bitcoin (BTC) surging as much as 1,223% this bull cycle from its current price of $34,000. “Bitcoin to […] The post Top Analyst Reveals Just How High Bitcoin, Ethereum and Six Additional Altcoins Can Go This Cycle appeared first on The Daily Hodl.",0.3612,0.043,0.0,0.957
2021-01-31,"One of the most groundbreaking developments in the decentralized finance landscape today is the steady rise of Automated Market Makers (AMMs). But with so many AMMs, the need for aggregators like Matcha has become essential.",0.3612,0.068,0.0,0.932
2021-01-31,Ethereum (ETH/USD) rallied higher early in today's North American session as the pair appreciated to the 1372.33 area after trading as low as the 1338.55.,0.296,0.116,0.074,0.81
2021-01-31,"The world's second-largest cryptocurrency Ethereum (ETH) has been testing investors' patience for quite a while! After hitting its new all-time high above $1450, ETH has been largely consolidating between $1350-$1400 levels.",0.0,0.0,0.0,1.0
2021-01-31,"Ethereum is trading at the $1300 level and the price is up nearly 5.7% in the past week. After hitting $1426 on Jan 29, 2021, the price dropped without hitting $1500, which is to a certain extent comparable to what happened to Bitcoin.",0.2732,0.049,0.0,0.951
2021-01-31,"While admitting that institutions view BTC as a store of value, Coinbase's 2020 report also noted that Ethereum has attracted substantial attention as well.",0.7964,0.324,0.0,0.676
2021-01-31,"Disclaimer: The findings of the following analysis are the sole opinions of the writer and should not be taken as investment advice The second-largest cryptocurrency, Ethereum [ETH] has remained unimpacted by Bitcoin's volatility over the past couple of days. The value of the digital asset has managed to stay above the $1,322 support and was currently […]",0.765,0.123,0.0,0.877
2021-01-31,The biggest crypto market after that of Bitcoin's has to be Ethereum. It has been the second-largest altcoin in the market noting an 85% surge since the beginning of the year.,0.0,0.0,0.0,1.0
2021-01-31,Bitcoin price fell back into the descending triangle but this dip may attract buyers to altcoins and DeFi tokens in the short term.,0.5023,0.129,0.0,0.871
2021-02-01,"Ethereum struggled to clear the $1,400 resistance and declined to $1,275 against the US Dollar. ETH price is struggling, but it could recover once there is a clear break above $1,350.",0.3818,0.149,0.103,0.747
2021-02-01,"Ethereum miners have brought in $800 million in January revenue, which surpasses the previous record high seen three years ago.  The post Ethereum's $800 million January mining revenue surpasses 2018 highs appeared first on The Block.",-0.4404,0.0,0.077,0.923
2021-02-01,"Ethereum was consolidating under its all-time high and traders eagerly anticipated a breakout past this final level of resistance. Aave showed bullish momentum and could post further gains past $300, and does not yet hint at a pullback on its rally.",0.6124,0.119,0.0,0.881
2021-02-01,"The biggest winner of Crypto Briefing's CB10 Index in January was Ethereum's native token, ETH. The rebalancing witnessed a positive addition of 2.15% for Ethereum, whereas Bitcoin's share decreased the most with a negative 5.55% change.",0.683,0.22,0.091,0.688
2021-02-01,Ethereum (ETH/USD) came off early in today's North American session as the pair depreciated to the 1310.87 area after trading as high as the 1346.50.,0.0,0.0,0.0,1.0
2021-02-01,Digital asset manager Grayscale Investments said Monday that its Ethereum Trust (OTCQX: ETHE) is again open to accredited investors. Read more: Digital Asset Manager Grayscale Eyes DeFi Space With New Trust Filings,0.8974,0.298,0.0,0.702
2021-02-01,"Has the accumulation phase ended for Bitcoin (BTC), Ethereum (ETH) and XRP?",0.0,0.0,0.0,1.0
2021-02-01,"According to several key metrics, January turned out to be one of the best months ever for Ethereum.",0.6369,0.198,0.0,0.802
2021-02-01,"Ethereum is holding within a small range between $1,300 and $1,400. Ethereum will plummet to $1,200 or the 200 SMA if the support at $1,300 is broken.",-0.1027,0.091,0.104,0.805
2021-02-01,"ETH Price recently revisited the price levels above $1,400. The bullish leg tested the resistance at $1,450 but hit an immense seller congestion.",0.0,0.0,0.0,1.0
2021-02-01,"Source: Adobe/happy_e Get your daily, bite-sized digest of cryptoasset and blockchain-related news – investigating the stories flying under the radar of today's crypto news. Investing news Major crypto asset management firm Grayscale stated that its Grayscale Ethereum Trust is now open again as it resumed the private placement of its shares. The Trust's private placement is offered on a",0.7906,0.129,0.0,0.871
2021-02-01,"Although the month of January saw Bitcoin and Ethereum rise towards record levels, a correction soon followed and the market leaders saw their gains drop. The rest of the altcoin market reacted in a similar fashion and fell on the charts after a solid start to the month.",0.2263,0.083,0.044,0.873
2021-02-01,"Binance established Binance Smart Chain [BSC], a new blockchain a while ago and it has become popular among users. The platform that already homes over 100 projects has added a new service to BSC to keep up with the demands of its users.",0.6705,0.126,0.0,0.874
2021-02-01,"The group behind the GameStop pump, WallStreetBets, has targeted XRP as the next asset to pump. XRP price exploded by 169% to a high of $0.755 before quickly giving almost everything back in the next three hours.",0.5994,0.126,0.0,0.874
2021-02-01,"Bitcoin price is trading in a tight range, which is allowing multiple altcoins to push higher.",0.0,0.0,0.0,1.0
2021-02-02,"Ethereum gained bullish momentum above $1,350 against the US Dollar. ETH price is showing positive signs and it is likely to accelerate higher above $1,400.",0.7351,0.212,0.0,0.788
2021-02-02,"The world's second-largest cryptocurrency Ethereum (ETH) has made a bold move once again surging past $1400 levels earlier today. Earlier today, Ethereum (ETH) surged past $1400 but failed to hold the momentum to hit an all-time high.",-0.5647,0.045,0.111,0.845
2021-02-02,"Binance Coin marched to a new price record - above $50, ETH nearing ATH levels. BTC's dominance decreases as bitcoin remains stagnant around the $34K mark.",0.2023,0.073,0.0,0.927
2021-02-02,Analysts say the trading movement started by WallStreetBets may boost adoption of ether and other cryptocurrencies.,0.4019,0.153,0.0,0.847
2021-02-02,Glassnode analytics company spreads the word about a new ATH to do with ETH – stakers have locked almost $4.1 billion worth of coins in the Ethereum 2.0 deposit contract,0.1621,0.057,0.0,0.943
2021-02-02,"This will allow users to buy and sell shares of Grayscale's publicly traded Ethereum Trust. This avenue provides exposure to the largest decentralized smart contract platform without worrying about storage, security, or regulatory concerns.",0.9106,0.342,0.0,0.658
2021-02-02,"Many have been pushing Ethereum into the mainstream, claiming it to be the go-to cryptocurrency of the future. While Bitcoin remains the very first cryptocurrency and the biggest by market capitalization, its market dominance is slowly getting weaker, currently at 62.5%.",-0.2732,0.041,0.066,0.892
2021-02-02,Booming cryptocurrency lending platform BlockFi has reported a “record-breaking” interest payout for January.,0.4588,0.214,0.0,0.786
2021-02-02,"Ethereum rose on Tuesday, partially because of its positive correlation with Bitcoin, the top cryptocurrency that also notched gains, and partially because the Chicago Mercantile Exchange will offer Ethereum Futures effectively from February 8, 2021. Trades flocked into the second-largest cryptocurrency during the early European session, pushing its prices against the US dollar up by […]",0.8658,0.171,0.0,0.829
2021-02-02,The newly launched Codefi Staking purports to be a more secure staking solution for Ethereum 2.0.,0.6962,0.36,0.0,0.64
2021-02-02,Etheruem saw a solid 8% price hike today as the coin reached the 2018-ATH levels one more time. Will ETH be able to break above?,0.25,0.12,0.0,0.88
2021-02-02,"Binance CEO Changpeng ""CZ"" Zhao introduced two new products of his ecosystem amidst Binance Blockchain Week 2021: Binance Pay and Binance Lite",-0.1027,0.0,0.062,0.938
2021-02-02,Miner revenue jumped over 120% from the previous month.,0.0,0.0,0.0,1.0
2021-02-02,"Ethereum has notched another record high, soaring above $1,480",0.0,0.0,0.0,1.0
2021-02-02,Ethereum (ETH/USD) gave back some recent gains early in today's North American session as the pair depreciated to the 1408.63 area after trading as high.,0.34,0.091,0.0,0.909
2021-02-02,"Source: Adobe/AA+W Today, the second largest cryptosset by market capitalization, ethereum (ETH), surpassed its previous all-time high, set in January, as it inches closer to the USD 1,500 level. At pixel time (17:07 UTC), ETH trades at almost USD 1,488 and is up by 14% in a day and 12% in a week. The price almost doubled in a month and rallied by more than 710% in a year. ETH price chart:",0.0,0.0,0.0,1.0
2021-02-02,"Data shows 99.5% of the neutral-to-bearish Ether put options will become worthless above $1,360, leaving bulls with a significant advantage for the foreseeable future.",-0.0258,0.142,0.109,0.749
2021-02-02,"Several indicators point to another breakout rally in the second-largest cryptocurrency by market capitalization. Will institutional investors join their retail counterparts and smash through the $1,500 mark?",0.296,0.078,0.0,0.922
2021-02-02,"Growth in DeFi, increasing on-chain activity and the strength of the bullish Ethereum options market helped send Ether price to a new all-time high at $1,500.",0.7003,0.201,0.0,0.799
2021-02-02,"Ethereum price has touched $1,500 for the first time ever on Binance hitting a new all-time high at a market capitalization of over $170 billion. There are 2.9 million ETH coins locked inside the Eth2 deposit contract representing over $4.3 billion at current prices.",0.0,0.0,0.0,1.0
2021-02-02,"Ethereum has seen some strong momentum throughout the past few days, with buyers taking control as its price now hovers firmly above $1,400 The selling pressure in this price region has been dissipating with each visit, signaling that bulls could be on the cusp of sparking a breakout rally Where the market trends in the […]",0.2732,0.056,0.038,0.906
2021-02-02,Ethereum increased in price by over 14% in 24 hours.,0.2732,0.189,0.0,0.811
2021-02-02,"The price of ETH, the native cryptocurrency of the Ethereum network, hit a new all-time high on Tuesday. The post ETH price hits new all-time high above $1,500 days after previous record appeared first on The Block.",-0.4404,0.0,0.077,0.923
2021-02-02,"As of 2 February, Ethereum reached a new all-time high above $1,500, across major exchanges,  just days before the launch of the CME Ethereum futures contracts, which is slated for 8 February. The surge in price could have been a result of several positive announcements about the second-largest crypto by market cap.",0.6124,0.098,0.0,0.902
2021-02-02,"During the last year, Ethereum's DeFi ecosystem has grown exponentially to form a multi Billion Dollar market. As Decentralized Finance expands, it becomes more and more relevant to have cross-chain connections that enable crypto assets to flow instantly and seamlessly across blockchain networks. These make it possible for DeFi platforms to be an effective alternative […]",0.6369,0.107,0.0,0.893
2021-02-03,Lucrative DeFi investing opportunities and increasing participation from institutional investors are driving the amount of Bitcoin and Ethereum held on exchanges to new lows.,0.2023,0.098,0.068,0.833
2021-02-03,"Ethereum just created a new all time high price record of $ 1539 on 3rd Feb '21. However, that wasn't the only achievement from the camp of the largest smart contracts platform in the world, which has been flooded with new achievements and records lately.",0.5719,0.103,0.0,0.897
2021-02-03,"After tremendous price surges in decentralized finance coins and many smaller-cap crypto assets, attention is finally returning to Ethereum. The post Ethereum (ETH) rockets to a new all-time high at $1,500 as altcoin market cools appeared first on CryptoSlate.",0.1779,0.044,0.0,0.956
2021-02-03,"Ethereum breaks out from an ascending triangle aiming for new all-time highs at $1,800. ETH's uptrend has been validated by the MACD and the daily close above $1,400.",0.2263,0.066,0.0,0.934
2021-02-03,"Ethereum (ETH) is all blazing guns hitting its new all-time high above $1550 surging more than 13%. As expected, the world's second-largest cryptocurrency has finally given a breakout about its previous all-time high and has entered the price discovery mode.",0.0,0.0,0.0,1.0
2021-02-03,"Ethereum broke the $1,450 resistance and surged above $1,500 against the US Dollar. ETH price traded to a new all-time high at $1,550 and it is likely to continue higher.",-0.4215,0.0,0.091,0.909
2021-02-03,"Bitcoin bulls pushed BTC price through a key resistance level just a few hours after Ethereum closed above $1,500.",0.0,0.0,0.0,1.0
2021-02-03,"Ethereum prices have surged to record levels during Asian trading on Wednesday morning, topping $1,550 for the first time ever.",0.0,0.0,0.0,1.0
2021-02-03,"With Ether continuing to push into new all-time highs above $1,500, Eth2 now ranks as the third-largest crypto asset in terms of staked assets.",0.4939,0.16,0.0,0.84
2021-02-03,Bitcoin records strong growth but Ethereum is leading a broader market charge as DeFi projects continue their explosive growth.,0.7469,0.329,0.0,0.671
2021-02-03,Crypto market cap adds $100 billion in a day after Ethereum surged to a new all-time high and BTC broke out of its consolidation triangle.,-0.4215,0.0,0.113,0.887
2021-02-03,"Tether CTO has made an announcement that later today a gargantuan amount of 2,000,000,000 USDT will be moved from Tron chain to Ethereum",0.0,0.0,0.0,1.0
2021-02-03,"As Ethereum surpasses its all-time-high, and an 8-fold increase over the last year, many will wonder if, and how, the price of the number 2 cryptocurrency.",0.3818,0.135,0.0,0.865
2021-02-03,"Bitcoin and Ethereum have sliced through a critical resistance level that kept their prices at bay over the past three weeks. Now that buying pressure is picking back up, these cryptocurrencies face little to no obstacles ahead that would prevent further advances.",-0.7689,0.024,0.191,0.785
2021-02-03,"In a single day, Ethereum broke its all-time high, saw a record in open interest, and attracted a big amount of institutional capital. Here's the breakdown.",0.4588,0.203,0.098,0.699
2021-02-03,"During this time, Ethereum overtook the Avalanche network to become the third-largest staked token in the crypto economy. With 2.15 percent of its total supply staked, Ethereum has over $3.7 billion locked within its ETH 2.0 deposit address.",0.0,0.0,0.0,1.0
2021-02-03,"pNetwork launches yet another bridge between two top-tier smart contracts platforms, Ethereum (ETH) and Eos (EOS) with pEOS wrapped asset",0.6369,0.224,0.0,0.776
2021-02-03,"Data shared by Glassnode agency shows that whales who hold 1,000 ETH or more are shrinking in number, while smaller holders are grabbing Ethereum's native coin",0.4019,0.134,0.0,0.866
2021-02-03,"It appears that the trend is still bullish and Ethereum will likely continue increasing in the short/medium-term. Similarly, the ETH/BTC trend is also bullish, indicating another that upward move is expected.",0.0,0.0,0.0,1.0
2021-02-03,"Cryptocurrencies rallied Wednesday, led by gains in the Bitcoin and the Ethereum markets as traders pinned hopes on additional stimulus packages in the United States. The cost to purchase one Bitcoin shot past $36,000 while Ethereum's native token Ether notched a new record high at $1,574.",0.7906,0.16,0.0,0.84
2021-02-03,Ethereum developers met Tuesday to compare research on the eventual merge of Eth 1.x and Eth 2.0,0.0,0.0,0.0,1.0
2021-02-03,"Three prominent crypto strategists are revealing their target price for Ethereum (ETH) after the leading smart contract platform broke out of a month-long consolidation. As Ethereum prints a new all-time of $1,542, crypto analyst Michaël van de Poppe says the second-largest crypto asset may move higher, but suggests traders should wait for a correction before […] The post Top Traders Deliver Price Targets for Ethereum After Crypto Asset's Big Breakout appeared first on The Daily Hodl.",0.5499,0.096,0.025,0.879
2021-02-03,"Ethereum [ETH], the second-largest cryptocurrency by market cap, hit a new all-time high earlier today, with the crypto valued at $1,571, at the time of writing. That wasn't the only notable development in the crypto's ecosystem, however, since amidst the rising demand for the digital asset, Grayscale revealed that it had added $38 million worth […]",0.7003,0.122,0.025,0.853
2021-02-03,"Major US-based crypto investment company Grayscale saw yesterday ethereum (ETH) inflows surpass those of bitcoin (BTC). At the end of January, the company stated that its Grayscale Ethereum Trust (GETH), previously closed ""for administrative purposes,"" has been reopened as it resumed the private placement of its shares. Per the data provided by bybt.com,",0.6705,0.097,0.0,0.903
2021-02-03,"Ethereum's price tested its resistance level for a few weeks, before hitting a new all-time high of $1,540 on the charts, based on data from Santiment. In fact, at the time of writing, on-chain and technical analysis pointed to a short-term top ahead of the CME Futures listing.",0.2023,0.039,0.0,0.961
2021-02-03,GameStop comedown shows appeal of social-media-fueled trading. Dogecoin chatter in Reddit reveals cryptocurrency analogue.,-0.2023,0.0,0.122,0.878
