date,text,Compound,Positive,Negative,Neutral
2020-12-05,The volume of the Ethereum options market hit a record high as the demand for ETH increased in recent weeks. The post Ethereum options volume hits record high—but why is demand surging?,0.0258,0.063,0.091,0.846
2020-12-05,"Top decentralized finance (DeFi) coins have undergone a severe correction over the past day. Leading names such as MakerDAO's Maker (MKR), Aave's AAVE, Yearn.finance's YFI, amongst others, are down 10 percent in the past day.",-0.2023,0.049,0.071,0.879
2020-12-05,"While Bitcoin has been the center of attention for the past two weeks, Ethereum has started to garner traction again. CNN recently covered altcoins in an article published in its Business column, highlighting trends in non-BTC cryptocurrencies.",0.0,0.0,0.0,1.0
2020-12-05,The crypto community was slammed with news earlier this week that United States House representatives are looking to crack down on stablecoins. The post Ethereum community explodes over proposed stablecoin act from U.S. representatives appeared first on CryptoSlate.,0.4215,0.07,0.0,0.93
2020-12-05,There are now over one million DeFi users.  Dune Analytics has published data analyzing the usage of key DeFi protocols.,0.0,0.0,0.0,1.0
2020-12-05,"First conceived by Vitalik Burterin in Ontario, Ethereum is now available to Canadians in the form of an ETF.",0.0,0.0,0.0,1.0
2020-12-05,Interest in Ethereum continues to grow as the price heats up.,0.4588,0.231,0.0,0.769
2020-12-05,Ethereum is maturing as Grayscale says ETH is turning into an asset class with a new group of investors prioritizing it,0.3612,0.116,0.0,0.884
2020-12-06,"SushiSwap's native token SUSHI is surging higher after a correction in the price of Ethereum, which reflected poorly on DeFi. SUSHI is currently up by 20% in the past 24 hours alone, making it the best-performing Ethereum-based large-cap digital asset.",0.128,0.06,0.048,0.892
2020-12-06,Ethereum is consolidating in a contracting range above the $565 support against the US Dollar. ETH price must surpass $05 to start a strong upward move towards $625 and higher.,0.7184,0.188,0.0,0.812
2020-12-06,It appears that the “Coinbase Effect” is back. The post This privacy-focused Ethereum token is up 400% in a week after Coinbase listed it appeared first on CryptoSlate.,0.0,0.0,0.0,1.0
2020-12-06,Ethereum's metrics just keep hitting new highs.,0.0,0.0,0.0,1.0
2020-12-06,The Beacon Chain of ETH 2.0 launch now lets the Ethereum community use the newly implemented proof-of-stake (POS) methodology to validate transactions on the chain. Rewards come in the form of ETH.,0.6808,0.157,0.0,0.843
2020-12-06,Crypto adoption on Wall Street is booming. The post CEO of $10 billion fund expects Ethereum to gain Wall Street traction this year appeared first on CryptoSlate.,0.5267,0.116,0.0,0.884
2020-12-06,DeFi has given Ethereum a significant boost since this summer and the blockchain official kicked off its journey to its upgrade after securing enough funds for its deposit contract.,0.7003,0.214,0.0,0.786
2020-12-06,"Little Brother grows up Bitcoin's little brother Ethereum is starting to attract more attention. In an interview with Bloomberg, Michael Sonnenshein, Managing Director of Grayscale Investments, discussed growing interest in the cryptocurrency.",0.7351,0.199,0.0,0.801
2020-12-06,Select altcoins are moving higher as Bitcoin price gains strength and consolidates within a bull pennant.,0.6808,0.301,0.0,0.699
2020-12-06,"Ethereum has been closely tracking Bitcoin as of late, which has caused it to see some consolidation Where the crypto trends in the mid-term should depend largely on ETH's continued reaction to the $600 region Just as $19,000 is a key level for Bitcoin at the present moment, $600 is a crucial level for ETH, as breaks above this level often lead to inflows of buying pressure Where the cryptocurrency trends in the days and […]",-0.296,0.0,0.029,0.971
2020-12-06,"Yearn.finance's YFI governance token has been inching closer and closer to the $30,000 level for the past few days and weeks, with the selling pressure here proving to be somewhat significant on multiple occasions. Overall, the crypto's price is currently caught within a holding pattern similar to that seen by Bitcoin and Ethereum, Until the […]",-0.1761,0.027,0.039,0.935
2020-12-07,"After bitcoin's rally has helped catapult cryptocurrencies back into the headlines, investors are eyeing the sky-high returns of smaller so-called ""alt coins""—including ethereum, Ripple's XRP and chainlink...",0.0,0.0,0.0,1.0
2020-12-07,Ethereum is facing a strong resistance near the $600 and $602 levels against the US Dollar. ETH price must settle above $602 to start a strong increase in the near term.,0.836,0.255,0.0,0.745
2020-12-07,"Over one percent of the entire supply of Ethereum has now been staked on the deposit contract according to co-founder Vitalik Buterin. Staking for ETH 2.0 got off to a slow start when the deposit contract was officially deployed last month, but the target was hit with a late spurt, and the new blockchain launched … Continued The post One Percent of Ethereum Supply Already Staked, 6% in DeFi appeared first on BeInCrypto.",0.1901,0.025,0.0,0.975
2020-12-07,"Bitcoin's price settled over the weekend, but Ethereum grew thanks to the boom in Defi and Eth 2.0 rollout bringing more users.",0.5927,0.155,0.0,0.845
2020-12-07,"Ethereum blockchain native's token ETH expects to reach $750 in the fourth quarter as it holds above a crucial technical support level. On Monday, the ETH/USD exchange rate attempted to breach a short-term ascending trendline for the tenth time since November 26.",0.4215,0.091,0.0,0.909
2020-12-07,"Apple co-founder Steve Wozniak has announced a new project called Efforce, a blockchain-based marketplace to exchange tokenized energy. After Apple, this is the second company that Wozniak has co-founded after a gap of 45 years.",0.2732,0.063,0.0,0.937
2020-12-07,"Secret Network, a Layer 1 privacy-enabled blockchain, has announced that it will be bringing programmable privacy to the Ethereum blockchain on 14 December. The mainnet, scheduled to launch next week, will enable the Secret Ethereum Bridge that will create bridge mining opportunities for ETH and ERC-20 holders.",0.5719,0.099,0.0,0.901
2020-12-07,"When looking into the actual usability and functionality of the Ethereum network, it shows a similar story of mass usage compared with other major blockchains like Bitcoin. Not only is Ethereum currently significantly cheaper to transact with than Bitcoin, charging on average $0.30 for a normal Ethereum transaction, but it's also generating significantly more total … Continued The post Ethereum Network Showing Strength with Low Gas Prices and High Fee Totals appeared first on BeInCrypto.",0.5267,0.078,0.034,0.888
2020-12-07,"The ratio of the 24-hour Open Interest [OI] change and market cap seemed to highlight an interesting trend on the question of which coin is the most leveraged in the market. Interestingly, the most leveraged cryptocurrency isn't Bitcoin or any other crypto in the top 10 of CoinMarketCap's charts.",0.891,0.223,0.0,0.777
2020-12-07,"Ethereum saw a small 1.1% price hike today as the coin struggles to break the upper boundary of a symmetrical triangle. Against Bitcoin, it is also trading in a triangle and is close to the apex where a breakout can be expected.",-0.3612,0.0,0.063,0.937
2020-12-07,The hit Showtime show about the irrepressible Gallaghers had some crypto time in its final premiere episode,0.0,0.0,0.0,1.0
2020-12-07,"Over 1% of Ethereum's circulating supply is now locked up on the project's new beacon chain, just one week after its launch. The post 1% of all ETH is now staked on Ethereum 2.0's beacon chain appeared first on CryptoSlate.",0.0,0.0,0.0,1.0
2020-12-07,"The cryptocurrency market has been trading sideways for the past week losing some of its notorious volatility. The total market capitalization has been ranging from $550 billion to $592 billion as most of the major cryptocurrencies like Bitcoin, Ethereum, and Ripple have been consolidating.",-0.4588,0.051,0.112,0.837
2020-12-07,"With over 1 million ETH amounting to nearly $690 million being staked in the ETH 2.0 deposit contract, more and more exchanges and custodians are making staking services available to thousands of its users. In fact, Binance, Huobi, Kraken, OKEx, and Coinbase have already offered ETH 2.0 staking options to their users, with rewards ranging […] The post 1% ETH staked in deposit contract as decentralization numbers get ‘a bit worse' appeared first on AMBCrypto.",0.0,0.04,0.04,0.921
2020-12-07,Singapore is funding blockchain R&D. Germany's second-largest stock exchange's crypto app saw $1.21 billion in trading volumes this year.,0.0,0.0,0.0,1.0
2020-12-07,"Major cryptocurrencies Bitcoin, Ethereum, and Tether have all got a mention on the Season 11 premiere of the long-running American comedy-drama television series “Shameless” which features on Showtime. The first episode – ‘This Is Chicago' shows how Kevin (Steve Howey) is confused about the plight of one cryptocurrency user who says:  My Bitcoin.",-0.3182,0.0,0.044,0.956
2020-12-07,"Ethereum registered its highest weekly close in the past 120 weeks with a price level of $601.95. While the short-term outlook and momentum remained neutral over the past few days, ETH bulls might be able to bounce off the $580-support and attempt to go past $620.",0.0,0.0,0.0,1.0
2020-12-07,"Altcoins have outpaced Bitcoin's price appreciation this year. Though BTC rose by 170% since the beginning of the year, the altcoin market cap has grown by nearly 280%.",0.5106,0.109,0.0,0.891
2020-12-07,"Bitcoin price continues to meet resistance at $19,500, a signal that further sideways action in BTC and altcoins is on the cards.",0.0,0.0,0.0,1.0
2020-12-07,"Ethereum has seen some lackluster price action throughout the past few days, which comes as Bitcoin leads the crypto market into a consolidation phase The crypto will likely continue seeing some sideways trading until BTC finds some clear directionality The pivotal level for ETH at the moment appears to be $600, as the selling pressure here has proven to be significant in the past Each break above this level has been short-lived and followed by […]",0.296,0.056,0.028,0.916
2020-12-07,"The game itself isn't live yet, but card packs are already available as part of a pre-sale. Players will eventually be able to trade scarce cards on a secondary marketplace.",0.0,0.0,0.0,1.0
2020-12-07,"Ethereum, the market's second-largest cryptocurrency and the king of the altcoins, exhibited bullish bias at the time of writing. For the same, there seemed to be more than two reasons behind it.",-0.1027,0.0,0.043,0.957
2020-12-07,A bit of bitcoin price dumping occurred Monday while some investors dove back into DeFi with their ether.,-0.3182,0.0,0.126,0.874
2020-12-07,"He believes that rising adoption will drive Bitcoin higher next year, and that DeFi will have a similar effect on Ethereum.",0.0,0.0,0.0,1.0
2020-12-08,"Bitcoin has been unable to pass $20,000 leading investors to analyze where we are in the market cycle, “Ethereum-first and in some cases Ethereum-only” investors are entering the market, stablecoin creator Circle believes a Biden administration will be supportive of crypto, Coinbase plans to support the “spark” token airdrop for XRP-holders, and Hong Kong is working with China's central bank on digital yuan trials. #cryptocurrency #digitalfinance #finance Subscribe to CoinDesk on YouTube: http://www.youtube.com/subscription_c.",0.5994,0.065,0.0,0.935
2020-12-08,Ethereum is trading in a range below the $600 and $602 resistance levels against the US Dollar. ETH price could start a strong surge if there is a successful close above $600.,0.7964,0.208,0.0,0.792
2020-12-08,"Staking on the Ethereum 2.0 deposit contract got off to a slow start with many predicting that it would not reach the target in time. A week after the Beacon Chain genesis, there has now been over 1.2 million ETH locked up in the deposit contract.",-0.0191,0.0,0.024,0.976
2020-12-08,Ethereum is expected to shoot higher in the weeks ahead despite the recent price consolidation. The cryptocurrency has held well in the high-$500s despite some downward pressure in the Bitcoin price.,0.1501,0.116,0.07,0.814
2020-12-08,"In the ever-evolving world of cryptocurrencies, Ethereum (ETH) has unarguably been one of the most promising assets since its launch in 2015. Second, only to Bitcoin in terms of market cap (and perhaps popularity too), Ethereum has the distinctive advantage of being the foundational pillar of many fast-evolving technologies such as smart contracts and DeFi, … Continued The post ETH Investment 101: Is it a Good Idea to Buy Ethereum Now?",0.9283,0.199,0.0,0.801
2020-12-08,"Aaron Wright, a professor at Cardozo School of Law, believes Ethereum could “eat” Wall Street in the next 10 years. The post Professor: Ethereum could “eat” Wall Street in 5 to 10 years for 3 reasons appeared first on CryptoSlate.",0.0,0.0,0.0,1.0
2020-12-08,"MyEtherWallet has introduced ETH staking.  The pioneering Ethereum wallet has integrated Staked, a non-custodial service that enables users to stake their crypto assets in exchange for yield.",0.1779,0.064,0.0,0.936
2020-12-08,"MEW users can now stake their Ethereum to support the Eth2 network, helping build a decentralized network of reward-earning validator nodes.",0.5994,0.214,0.0,0.786
2020-12-08,"Long have the crypto overlords promised a solution that would aid the mass adoption of cryptocurrencies and decentralized apps (dApps).  In essence, Ethereum 2.0 (ETH 2.0), or Serenity, is a long-awaited update to the Ethereum network, attempting to solve some of the blockchain's most pressing issues.",0.6808,0.139,0.0,0.861
2020-12-08,"Ethereum is the most dominant cryptocurrency among the Top 4, based on activity, updates and the highest Github submission rate. The development team of Ethereum makes daily routine submissions that make it the busiest cryptocurrency that ranks #2 based on market capitalization.",0.2023,0.042,0.0,0.958
2020-12-08,Eth2's rollout could result in enterprises flocking to a more secure and scalable Ethereum network.,0.4005,0.172,0.0,0.828
2020-12-08,"The first-ever decentralized push notification service has raised $750K in its seed round. The post Balaji Srinivasan, Gitcoin co-founder back $750K seed round for decentralized notification system on Ethereum appeared first on The Block.",-0.4404,0.0,0.081,0.919
2020-12-08,"With the collective digital asset market showing little change over the past week, Ethereum too was victim to the same. Ether value ranged roughly between $565 and $620, maintaining position between the set of resistance and support.",0.6705,0.178,0.049,0.773
2020-12-08,"Ethereum has been closely tracking Bitcoin's price action over the past couple of weeks, which has opened the gates for it to see some serious weakness Where it trends in the mid-term will depend largely on whether or not bulls can eventually surmount $600 This has proven to be a crucial price region for ETH, and its sustained bout of trading beneath it may strike a serious blow to bulls One trader is now noting […]",-0.5994,0.0,0.09,0.91
2020-12-08,"One of Ethereum's most popular software wallets, MyEtherWallet, is giving users access to Ethereum 2.0 staking.",0.6697,0.282,0.0,0.718
2020-12-08,"The bitcoin market dipped again Tuesday while traders have scooped up ether options at the $1,120 price level.",0.0,0.0,0.0,1.0
2020-12-09,Ethereum is primed to move lower in the days ahead as the cryptocurrency slides below $570 for the first time in many days. ETH is expected to see weakness in the near term as it slides below key technical levels with Bitcoin.,-0.6124,0.0,0.111,0.889
2020-12-09,"More than 100,000 Ether, valued at $60 million, has already been locked up for Eth2 staking using Kraken within four days of the exchange launching the service.",0.4404,0.1,0.0,0.9
2020-12-09,Ethereum started a strong decline after it failed to surpass $600 against the US Dollar. ETH price declined over 6% and it is now trading near the $550 level.,0.0,0.101,0.101,0.798
2020-12-09,It was only a matter of time until centralized cryptocurrency exchanges jumped on the ETH 2.0 staking train with their own services. Kraken has been one of the latest to launch staking and it has been wildly popular.,0.4404,0.1,0.0,0.9
2020-12-09,"One of the leading International banking groups, Standard Chartered has taken its first step towards cryptocurrency. Its innovation arm, SC Ventures announced a partnership with Northern Trust to launch an institutional-grade custody solution for cryptocurrencies, called Zodia Custody.",0.802,0.194,0.0,0.806
2020-12-09,"Bitcoin has fallen sharply over the last 24 hours, moving away from the key $20,000 per bitcoin level...",-0.3612,0.0,0.128,0.872
2020-12-09,"Breaking down Ethereum 2.0 and its sweeping impact on crypto markets, weekly.",0.0,0.0,0.0,1.0
2020-12-09,"ETH 2.0 rollout saw phase 0 of its multi-year roll-out commence on December 1st with the launch of the Beacon chain. The new proof-of-stake-based ethereum network has been the talk of the crypto town as many see it as a revolution in the field of blockchain scalability, once fully functional the ETH 2.0 network would The post ETH 2.0 Update: $22 Million Worth of ETH Being Staked Everyday appeared first on Coingape.",0.2263,0.027,0.0,0.973
2020-12-09,"One of the key components of this advancement to the network was the adoption of a new verification method, with Ethereum moving from Proof-of-Work (PoW) to Proof-of-Stake (PoS). This change means that users will now have to stake their Ethereum on the network as collateral to validate.",0.3612,0.053,0.0,0.947
2020-12-09,"Blockchain interoperability has been a long-time dream for the Ethereum network, and ConsenSys eyes the latest release to deliver it.",0.25,0.1,0.0,0.9
2020-12-09,"Bitcoin dominance rose marginally to 64%, meaning that the altcoin market was dropping in value slightly faster than Bitcoin over the past few hours. Polkadot and Steem showed strong bearish momentum as they lost important levels of support to the bears in the last few hours.",0.8271,0.221,0.042,0.737
2020-12-09,"ETH is trapped inside a symmetrical triangle, however, the overall trend is still Bullish.",-0.5267,0.0,0.221,0.779
2020-12-09,"Ethereum could be on the cusp of seeing an explosive move higher in the coming few days This notion seems rather surprising, given the weakness seen across the entire market as of late, but its price has been able to hold above one crucial level This level could act as a base for further growth in the days and weeks ahead, and ultimately put the control of its near-term trend back into the hands of […]",0.4678,0.063,0.024,0.913
2020-12-09,"The STABLE Act regulating the burgeoning stablecoin industry is misplaced and overly broad, says our columnist.",0.4466,0.164,0.0,0.836
2020-12-09,"Ethereum price is currently hovering at $570 after a brief pullback from which the bulls managed to recover quickly. There are several on-chain metrics in favor of Ethereum, but the price hasn't reacted just yet.",0.2144,0.053,0.0,0.947
2020-12-09,"Bitcoin and several altcoins have recovered sharply from their intraday lows, a signal that there is healthy demand at lower levels.",-0.2023,0.112,0.227,0.661
2020-12-09,Bulls swooped in to buy Ethereum as it dropped to a critical support level and now they've set their sights on $590.,0.1027,0.113,0.096,0.792
2020-12-09,"Ethereum has been closely tracking the price action seen by Bitcoin and other major altcoins, but it has been able to dodge seeing any intense decline overnight Although it did plunge as low as $530, the cryptocurrency's support at this level sparked a “V-shaped” recovery that allowed it to surge up towards the upper-$500 region […]",0.3291,0.084,0.044,0.872
2020-12-10,"Ethereum and Bitcoin underwent a strong drop the other day after days of consolidation. Ethereum slipped from the $590 region to lows around $550, marking a strong decline for the cryptocurrency that had benefited so much from the ETH2 launch.",0.5719,0.148,0.088,0.764
2020-12-10,Canadian institutional digital asset manager 3iQ is about to close an initial public offering for its Ethereum fund on the Toronto Stock Exchange.,0.3612,0.102,0.0,0.898
2020-12-10,Ethereum declined towards the $530 zone before recovering above $550 against the US Dollar. ETH price is now facing a strong resistance near the $580 level and the 100 hourly SMA.,0.5106,0.102,0.0,0.898
2020-12-10,"Everything Apple co-founder Steve Wozniak touches turns to gold, apparently. The post Apple co-founder Steve Wozniak's Ethereum-based crypto rallies another 100% appeared first on CryptoSlate.",0.0,0.0,0.0,1.0
2020-12-10,"Ethereum (ETH/USD) looked to add to recent price gains as traders continue to eye the psychologically-important 650 level following the pair's ongoing appreciation.  Notably, ETH/USD.",0.6908,0.199,0.0,0.801
2020-12-10,"Bitcoin and Ethereum fell dramatically in the past 24 hours. Though prices have returned to pre-crash levels, multiple technical indicators suggest the worst is yet to come.",-0.6249,0.0,0.136,0.864
2020-12-10,Grayscale has added more than $325 million worth of Bitcoin and Ethereum to its trusts in just over a week.,0.6124,0.227,0.0,0.773
2020-12-10,"The firm has already launched a public Bitcoin fund on the Toronto Stock Exchange and is now expanding its offering with the Ether Fund. The Ether Fund IPO According to Tyler Winklevoss, Bitcoin billionaire and co-founder of Gemini, a cryptocurrency exchange and custodial platform, 3iQ's Ether fund has raised approximately $75 million before the IPO.",0.128,0.028,0.0,0.972
2020-12-10,"According to recent data, Grayscale fund acquired an astounding amount of crypto yesterday in Bitcoin and Ethereum, totaling $55,305,000 and $23,142,357",0.4215,0.123,0.0,0.877
2020-12-10,Most major DeFi tokens will be available for trading on Eos.,0.0,0.0,0.0,1.0
2020-12-10,"Over the course of his 18-month term, Tarbert has been a consistent advocate for principles-based regulation of crypto.",0.0,0.0,0.0,1.0
2020-12-10,"Today, the digital asset landscape is slowly acclimating to the fact that Ethereum 2.0 is finally taking place. In fact, after the recent launch of the Beacon Chain, speculated rumors about more delays and apparent lack of support have all been squashed.",0.4404,0.112,0.049,0.839
2020-12-10,"The number of developers in crypto is ticking up again, and one network remains a clear winner in attracting coders.",0.8689,0.419,0.0,0.581
2020-12-10,"Speaking at Yahoo Finance's All Markets Summit in New York in October 2019, Tarbert said, “we've been very clear on bitcoin: bitcoin is a commodity. We haven't said anything about ether—until now.",0.4391,0.088,0.0,0.912
2020-12-10,The request for the EIP 1559 technical proposal on Ethereum went live on the Github code repository on December 10. The post Ethereum will become more scarce: why this ETH upgrade is a game-changer appeared first on CryptoSlate.,0.0,0.0,0.0,1.0
2020-12-10,"Ethereum has been struggling to break free of its connection to Bitcoin, with the benchmark cryptocurrency having massive control over its price action This has so far been quite bearish for ETH, as it has caused the cryptocurrency to see notable losses on multiple occasions Where it trends next should depend largely on whether or not bulls and bears can hold BTC above $18,000, as a dip below this level could be grim One trader […]",-0.7096,0.04,0.11,0.85
2020-12-10,"A self-proclaimed blockchain enthusiast named Mark Rex tweeted a screenshot of a spreadsheet. The data suggests that Grayscale purchased another 1276 BTC on Dec 9, 2020, and 13,232 BTC over the past week.",0.3612,0.079,0.0,0.921
2020-12-10,"Bitcoin slipped below $18,000 again Thursday as ether's volatility in 2020 shows a different dynamic.",0.3818,0.167,0.0,0.833
2020-12-10,"We aren't talking about making things more secure in the crypto world, says Ethereum's co-founder. And user-friendly wallets are a must.",0.4005,0.124,0.0,0.876
2020-12-10,"The Ether Fund, the first ETH-based ETF product on the Toronto Stock Exchange, has been officially listed after raising more than $75 million from investors.",0.0,0.0,0.0,1.0
2020-12-11,"It is “IPO season” in the stock market, and among the companies going public for the first time, is food-delivery firm DoorDash. In its stock market debut, the individual share price brought the total market cap above the entire Ethereum market cap instantly.",0.296,0.05,0.0,0.95
2020-12-11,"Ethereum is on the verge of a breakdown to $500, mostly if the support at $540 fails to hold. The bearish outlook will be abandoned if Ether closed the day above $540 and perhaps reclaimed the ground past $560.",-0.4767,0.062,0.133,0.805
2020-12-11,Digital asset investment managers 3iQ introduced ETH market exposure to Canada's stock traders and investors on Thursday.,0.3612,0.135,0.0,0.865
2020-12-11,A newly-released WordPress plugin called EthereumAds allows content creators to auction ad space and receive ETH in return. ETH-Based Ad Placement EthereumAds works just like many other auction-based ad services.,0.3612,0.082,0.0,0.918
2020-12-11,Ethereum failed to surpass the main $580 resistance against the US Dollar. ETH price is declining and it is showing bearish signs below the $560 and $550 levels.,-0.5106,0.0,0.109,0.891
2020-12-11,"Legendary investor Raoul Pal has made some bold statements about Ethereum, suggesting that its market capitalization may surpass that of Bitcoin within the next decade.",0.3818,0.098,0.0,0.902
