date,text,Compound,Positive,Negative,Neutral
2021-01-04,"Bitcoin price started a downside correction below the USD 32,500 support. BTC declined over 15% and it even spiked below USD 30,000. The bulls were active near USD 28,500 and the price is currently (13:00 UTC) trading above the USD 30,000 level. Similarly, there was a sharp downside correction in most major altcoins, including ethereum, EOS, XLM, LINK, BNB, OMG, NEO, TRX, bitcoin cash, DOT,",0.34,0.079,0.058,0.863
2021-01-04,"Ethereum dropped heavily during the thinly-traded early European session Monday, breaking below $1,000 from its three-month high of $1,168.99. The second-largest cryptocurrency briefly tumbled to $886 due to profit-taking among daytraders.",0.0,0.0,0.0,1.0
2021-01-04,"As Ethereum shoots above $1,000, gas fees reach a new high",0.0258,0.109,0.0,0.891
2021-01-04,"Ethereum's surge above $1,000 to record a new yearly high of $1,153 helped the second-largest cryptocurrency by market cap to record new highs including a market cap over $100 billion for the first time since the last bull run. ETH in its current bullish rally also flipped bitcoin for the highest daily spot trading volume The post Ethereum Records $4.7 B in Daily Volume at Binance While Rising ETH Fees Raises Concerns appeared first on Coingape.",0.0,0.0,0.0,1.0
2021-01-04,"Disclaimer: The findings of the following analysis are the sole opinions of the writer and should not be taken as investment advice Ethereum surged from $715 to $1,169 in a span of three days. However, the $1,168 high was momentary and the price was soon forced to retrace as Ether formed a swing failure pattern.",-0.743,0.0,0.11,0.89
2021-01-04,"Two of the world's largest cryptocurrencies by market cap set new records over the weekend. The post Bitcoin price jumps above Dow Jones Index (DJI) while Ethereum nears $1,100 appeared first on CryptoSlate.",0.0,0.0,0.0,1.0
2021-01-04,"Ethereum bulls are facing a serious test above $1,000 following a massively volatile day. The price is now looking at the first resistance to conquer after reclaiming $1K.",-0.0772,0.0,0.049,0.951
2021-01-04,"Ethereum spiked as high as $1.1k after a 30% advance on Sunday, a level not seen since February 2018. The market has since cooled off, back to just below the $1k level at the time of writing.",0.0,0.0,0.0,1.0
2021-01-04,"Bitcoin and Ethereum prices dropped all the weekend gains before the traditional markets opened for trading Monday, liquidating $1.1 billion leveraged orders.  Nevertheless, market sentiments continue to wax bullish despite the carnage.",0.34,0.072,0.0,0.928
2021-01-04,Ethereum (ETH/USD) reclaimed some lost ground early in today's North American session as the pair marched higher to the 1059.74 area after trading as low.,-0.5267,0.0,0.161,0.839
2021-01-04,Ethereum 2.0 continues to struggle with the scaling woes of its predecessor.,-0.6369,0.0,0.342,0.658
2021-01-04,"Ethereum Layer-2 scaling solution Optimistic PBC has announced a firm date for when it will launch its mainnet trial with Synthetix.  Ethereum Gas Fees Force Alternatives Optimism PBC announced a trial run of its highly-anticipated Layer-2 Ethereum scaling solution, Optimistic Network , on Jan. 15.",0.8934,0.256,0.0,0.744
2021-01-04,"Multiple data points show investors are strongly bullish on Ethereum price even after today's sharp rejection at $1,160.",-0.34,0.097,0.162,0.741
2021-01-04,"Ethereum, the world's largest altcoin, was undergoing significant price turbulence, at the time of writing, with the cryptocurrency registering massive swing trades between the range of $890 and $1169. However, the cryptocurrency's volatility might not be important for the token going forward.",0.0536,0.041,0.037,0.922
2021-01-04,"After today's sharp downside move, Bitcoin and altcoins could trade in a sideways range as bulls and bears fight to control the market's momentum.",-0.5574,0.0,0.18,0.82
2021-01-04,"Ethereum has seen some immense bullishness throughout the past 24-hours, with the crypto breaking free from its range-bound trading in the $700 region and rocketing past $1,000 Where the entire market trends in the mid-term may depend largely on whether or not Bitcoin can maintain its foothold in the lower-$30,000 region If the crypto can hold above here and consolidate, it could provide ETH and other altcoins with further room to rally in the days […]",0.5106,0.042,0.0,0.958
2021-01-04,"In just 48 hours, Ethereum rocketed over 50% from $770 to roughly $1140 at last night's overnight high. The massive Sunday candle was the lead up to a sell signal forming on daily timeframes.",0.0,0.0,0.0,1.0
2021-01-05,"Ethereum corrected lower sharply from a new all-time high at $1,166 against the US Dollar. ETH price remained well bid near $900 and it is currently showing signs of a fresh increase.",0.5423,0.192,0.063,0.745
2021-01-05,Ethereum prices revisited the four-figure territory again this morning following a minor pullback that threatened heavier losses. Some on-chain metrics are suggesting it is still undervalued even after its recent rally.,-0.6908,0.0,0.169,0.831
2021-01-05,"Ethereum bulls should prepare for a price rally towards $2,000 in the next couple of weeks/months, per a recent analysis provided by Jebb McAfee. The independent market analyst spotted a flurry of upside fundamentals, ranging from Ethereum's growth as a decentralized application server to its rising search volumes on Google, before deciding to go all bullish on the world's second-largest cryptocurrency.",0.3818,0.044,0.0,0.956
2021-01-05,"The crypto market cap lost $70 billion since yesterday's record but BTC has increased back to $31,000, while ETH marched above $1,000 again.",0.25,0.105,0.065,0.83
2021-01-05,"After dropping $5,000 in a matter of hours yesterday, Bitcoin's price has recovered thanks to new regulatory clarity in the US.",0.6908,0.283,0.0,0.717
2021-01-05,Ethereum (ETH/USD) pulled back early in today's North American session as the pair weakened to the 1005.47 area after trading as high as the 1056.14.,-0.3182,0.0,0.087,0.913
2021-01-05,"Racing ethereum (ETH) prices have seemingly failed to impress Chinese crypto users, with interest in the token – as well as blockchain technology – almost unchanged despite record-breaking recent altcoin rallies. Data from WeChat shared on Twitter by Primitive Crypto co-founder Dovey Wan showed that while interest in bitcoin (BTC) spiked as the token broke through the",0.743,0.199,0.09,0.711
2021-01-05,The average transaction cost on the Ethereum network almost doubled amid a trading volume surge.,0.0,0.0,0.0,1.0
2021-01-05,"DeFi TVL is breaking new highs at $18 billion, but most of it is just the Ether and Bitcoin rally.",0.0,0.0,0.0,1.0
2021-01-05,The staking protocol is oversubscribed by over 428% of its requisite threshold. It's now the fifth biggest staking network in the world.,0.0,0.0,0.0,1.0
2021-01-05,"Grayscale, the crypto fund manager today announed the delisting of XRP from its Grayscale Removes XRP From its Digital Large Cap Fund (DLC) post the quarterly review. The fund manager also notified that it has utilized the cash proceeds from the sale of XRP towards buying more bitcoin, ethereum, and other assets.",0.1779,0.032,0.0,0.968
2021-01-05,Quick take 1 minute read Network fees on Ethereum are getting ready to continue climbing.  This $17 per transaction is an all-time high in average.,0.3612,0.098,0.0,0.902
2021-01-05,The previous year witnessed significant growth in decentralized applications. Total locked value locked (TVL) across all DeFi apps had hit $1 billion at the beginning of January 2020.,0.7003,0.214,0.0,0.786
2021-01-05,Quick take 1 minute read The world of crypto has once more been thrown into the mainstream media.  Bitcoin and Ethereum have been two assets.,0.1779,0.069,0.0,0.931
2021-01-05,"Some of the market's altcoins like Monero and Dash failed to recoup their losses after Bittrex's delisting announcement last week. However, XMR and DASH weren't the only ones as Ethereum Classic too projected a southbound move as the market bears sought control of the prices.",-0.5423,0.051,0.121,0.828
2021-01-05,"The aggregated open interest on Ethereum (ETH) options and futures broke records this past weekend, according to data compiled by The Block Research.  The post Open interest on Ethereum derivatives hit an all-time high on Sunday appeared first on The Block.",-0.3818,0.119,0.17,0.711
2021-01-05,"Ethereum has been caught in a wild bout of turbulence these past few days, primarily because of its recent breakout rally that allowed it to gain serious ground against Bitcoin The cryptocurrency has been able to flip the crucial $1,000 level into support, and bulls are in the process of defending it presently It is imperative that bulls can continue defending this level in the near-term, as any dip below it could lead to a […]",0.7003,0.078,0.017,0.906
2021-01-05,"Once Bitcoin finally began to cool off, capital began to flow into Ethereum causing an enormous breakout. The rapid rise took the altcoin to an over 50% increase in just two days, but a selloff stopped the token's booming trend in its tracks.",-0.0129,0.074,0.053,0.873
2021-01-05,U.S. Treasury and corporate bonds are returning lower yields than ever. Ethereum's currency ether (ETH) presents an alternative.,-0.1027,0.09,0.11,0.8
2021-01-05,Bitcoin breaks $34K while ether futures continue to gain steam.,0.5267,0.274,0.0,0.726
2021-01-05,Institutional investors borrowed ETH to profit off the Grayscale Ethereum Trust. Now they're having to pay it back as ETH climbs higher.,0.7003,0.233,0.053,0.714
2021-01-06,"Internet searches and interest in Ethereum are likely to exceed levels in 2017 according to Google Trends. ETH price, meanwhile, has reclaimed $1,100.",0.4588,0.12,0.0,0.88
2021-01-06,"Ethereum started a fresh increase above $1,050 against the US Dollar. ETH price is showing positive signs and it is likely to continue higher towards the $1,200 and $1,250 levels.",0.802,0.24,0.0,0.76
2021-01-06,"After clearing the USD 32,500 resistance, bitcoin price started a fresh surge. It is up over 12% and it broke the USD 34,000 resistance. BTC broke the USD 35,000 resistance, traded to a new all-time high near USD 35,750, and it is currently (05:00 UTC) consolidating gains. Similarly, there was a strong upward move in most major altcoins, including ethereum, EOS, XLM, LINK, BNB, OMG, NEO, TRX,",0.34,0.11,0.077,0.813
2021-01-06,Ethereum (ETH/USD) extended its recent rally early in today's North American session as the pair strengthened to the 1170.00 area after trading as low as.,0.1779,0.1,0.075,0.824
2021-01-06,"For three months, Ethereum was settling more value than Bitcoin each day. But now Bitcoin is back in the lead.",0.4005,0.124,0.0,0.876
2021-01-06,"Ethereum has the potential to extend its ongoing upside move towards or above $1,500. The second-largest cryptocurrency broke above a consolidation price channel on Wednesday, breaking its upper trendline on surging volumes.",-0.2732,0.051,0.084,0.866
2021-01-06,"Quick Take 1 minute read Despite currently being priced at $1118 following a 7.23 percent increase over the past 24 hours, shares in the Ethereum.",0.5423,0.176,0.0,0.824
2021-01-06,Ethereum's rapid price increase over the last few weeks has pushed it into the top 100 assets in the world.,0.5859,0.254,0.0,0.746
2021-01-06,Crypto custodian and infrastructure provider BitGo has successfully launched WBTC on the TRON network. The move brings tokenized bitcoin to the TRON ecosystem while tapping.,0.5719,0.17,0.0,0.83
2021-01-06,Bullish price activity has tipped the total value of ETH locked into Ethereum 2.0 past $2.4 billion.,0.34,0.13,0.0,0.87
2021-01-06,Quick Take 1 minute read Things seem to be looking good when it comes to Ethereum.  To start the year in such a position is.,0.4404,0.116,0.0,0.884
2021-01-06,"Etheruem saw another 12% price hike today as it breaks beyond $1100 to reach the current $1145 level. Against BTC, ETH continued to climb higher above 0.033 BTC and is approaching the November 2020 highs.",0.0258,0.031,0.0,0.969
2021-01-06,BTSE exchange has launched a Monero-backed token on Ethereum called Wrapped Monero (WXMR). The innovation arrives amidst a wave of delistings for various privacy-centric tokens.,0.4767,0.163,0.0,0.837
2021-01-06,"Source: A screenshot, Instagram/shapeshift_io Get your daily, bite-sized digest of cryptoasset and blockchain-related news – investigating the stories flying under the radar of today's crypto news. Exchanges news ShapeShift said it has integrated decentralized exchange protocols and is sunsetting its 6+ year business of trading with customers. ShapeShift's users no longer need to provide",-0.296,0.0,0.041,0.959
2021-01-06,"The price of ether (ETH) has surpassed $1,200 on Coinbase Pro today, reaching highs not seen since January of 2018. The post ETH trades above $1,200, reaching market level not seen since January 2018 appeared first on The Block.",-0.0772,0.085,0.068,0.847
2021-01-06,"ShapeShift, one of the oldest cryptocurrency trading platforms in the crypto market, is pivoting. The post New DeFi entrant?",0.0,0.0,0.0,1.0
2021-01-06,"Roger Ver. Now the third worst-performing major cryptoasset, bitcoin cash (BCH), in 2030, will be worth almost 229 times its current price, according to Roger Ver, tech entrepreneur and investor and Bitcoin Cash evangelist, who said is also bullish on ethereum (ETH). “The more useful something is, the more people will use it,” Ver told Cryptonews.com, estimating a",0.624,0.085,0.0,0.915
2021-01-06,"Ethereum has hit yet another all-time high, surging with other cryptos",0.0,0.0,0.0,1.0
2021-01-06,"The price of Ethereum has gone from $737 to $1,200 in a matter of days. Will it break its all-time high, or is a price correction on the way?",0.0258,0.041,0.0,0.959
2021-01-06,"There were significant positives for Ethereum in 2020, with the world's largest altcoin stepping into 2021 on the right foot. Between the 1st and 3rd of January, the cryptocurrency's value hiked from $725 to $990, with the following day seeing ETH touch a high of $1169 too.",0.765,0.15,0.0,0.85
2021-01-06,"Bitcoin's slow crawl toward $36,000 has given select altcoins the green light to rally higher.",0.0,0.0,0.0,1.0
2021-01-06,"Ethereum (ETH) is trading above $1,200. The second largest cryptocurrency by market cap hit a high price of $1,207 on multiple exchanges today, its first time at the price level since January 2018.",0.0,0.0,0.0,1.0
2021-01-06,"Ethereum has been rocketing higher throughout the past few days, with its latest round of upside kicking off after the sudden rally from the mid-$700 region to over $1,000 The crypto has now established a solid foothold within the $1,000 region, and bulls confirmed this level as support yesterday This is indicative of its present strength, and its ability to climb today while Bitcoin consolidates has given its BTC pair some strength Where the entire […]",0.9001,0.157,0.0,0.843
2021-01-06,"In a significant development, DeFi TVL has gotten past $21 billion as a record 6.8M ETH now occupy financial smart contracts. Ethereum itself has recorded gains of 8.3% over the last 24 hours and a massive 62.4% over the last week, as the largest smart contracts platform in the world hovers at $1200.",0.8225,0.173,0.0,0.827
2021-01-07,"ETH broke above $1,200 for the first time in almost three years, extending its weekly gains to 62%.",-0.1027,0.113,0.132,0.755
2021-01-07,"Ethereum is nearing its former all-time high of $1,440 set back in 2018 at the peak of the crypto bubble. Those who hed the altcoin throughout the bear market are finally getting the comeback they have been waiting for.",0.0,0.0,0.0,1.0
2021-01-07,Ethereum's recent gains saw it join Bitcoin on an exclusive list among the world's biggest movers and shakers.,0.6597,0.346,0.0,0.654
2021-01-07,"Ethereum extended its rise above the $1,150 and $1,200 resistance levels against the US Dollar. ETH price is currently consolidating gains and it could rise further towards $1,280.",0.34,0.082,0.0,0.918
2021-01-07,"After a fresh bullish breakout above USD 35,000, bitcoin price started a fresh rally. BTC broke the USD 36,000 resistance and extended its rally above USD 37,000. It traded to a new all-time high close to USD 37,700 and it is currently (05:00 UTC) consolidating above USD 37,000. Similarly, there was a strong upward move in most major altcoins, including ethereum, EOS, XRP, XLM, LINK, BNB, OMG,",0.6249,0.113,0.04,0.846
2021-01-07,Google searches for Ethereum have skyrocketed along with the asset's price recently. ETH is now less than 20% away from its all-time high.,0.0,0.0,0.0,1.0
2021-01-07,The value of the combined bitcoin and cryptocurrency market has surged to over $1 trillion as prices rise across the board...,0.34,0.107,0.0,0.893
2021-01-07,"The wave of decentralized finance applications that launched in 2020 owed a great debt to the smart contract platform Ethereum, where traders busily pushed DeFi volumes into the billions. Ethereum-based decentralized applications (dApps) were the biggest success story of the year, at least if you discount Bitcoin's stratospheric push towards $30k.",0.8591,0.202,0.042,0.756
2021-01-07,Peaking implied volatility spreads suggest the emphasis in the markets will shift to ether and other alternative currencies in the short term.,0.0,0.0,0.0,1.0
2021-01-07,"Media coverage of the latest crypto rally has largely focused on bitcoin (BTC)'s performance, with the token smashing all sorts of price records in recent weeks. But this bull market is not all about the BTC – altcoins are also having a field day, particularly bitcoin's seemingly perpetual bridesmaid ethereum (ETH). And with ether experiencing growth of over 100%",0.6369,0.086,0.0,0.914
2021-01-07,Quick Take 1 minute read Yesterday was the first time in three years that Ethereum broke above $1200 as bullish sentiment runs throughout the industry.,-0.4215,0.0,0.109,0.891
2021-01-07,"Sorare is a blockchain-based fantasy soccer game.  It leverages the popularity of classic soccer trading cards and fantasy league games, enabling players to trade, enter tournaments, and win prizes with digital collectibles.",0.872,0.261,0.0,0.739
2021-01-07,Ethereum is accelerating toward its highest valuation ever.,0.0,0.0,0.0,1.0
2021-01-07,Quick Take 1 minute read Many of the top crypto assets over the past week have been accelerating massively on the markets.  Ethereum is no.,0.0772,0.131,0.082,0.787
2021-01-07,Ethereum (ETH/USD) moved higher early in today's North American session as the pair appreciated to the 1234.12 area after trading as low as the 1160.71.,0.296,0.116,0.074,0.81
2021-01-07,"While some data shows the selling pressure increasing for ethereum (ETH) this year, and remaining largely unchanged for bitcoin (BTC) as it keeps hitting new all-time highs - other data sends mixed signals, suggesting that more market participants want to buy the two major coins, not sell them. According to the data by blockchain analysis firm Chainalysis, there was an",-0.1621,0.026,0.036,0.938
2021-01-07,Will Ether be able to replicate the 2016 Bitcoin bull run with DeFi's momentum? Several analysts believe so.,0.0,0.0,0.0,1.0
2021-01-07,"Ethereum soars to new yearly highs while buyers target highs above $1,400 in the short term. ETH 2.0 staking hits 2% of the total Ethereum supply, thus reducing the overhead pressure.",-0.296,0.0,0.068,0.932
2021-01-07,"Get your daily, bite-sized digest of cryptoasset and blockchain-related news – investigating the stories flying under the radar of today's crypto news. Adoptions news Bitcoin (BTC) has outperformed Ethereum (ETH) in terms of the daily transferred value, reaching USD 14.58bn per day, compared to Ethereum's USD 13.96 per day, according to the data provided by Money",0.4939,0.073,0.0,0.927
2021-01-07,"Ethereum's market capitalization has broken its previous all-time high, according to market data from TradingView. The post ETH's market capitalization hits a new all-time high appeared first on The Block.",-0.7184,0.0,0.182,0.818
2021-01-07,"In a previous article, we discussed the changes that will take place after EIP-1559 is implemented on Ethereum and the modification of the current gas fee system.  As explained, the main objective of EIP-1559 remains to lower gas fees for its users so that individuals are not overpaying for their transactions to go through.",-0.296,0.0,0.041,0.959
2021-01-07,Ethereum 2.0 staking is becoming a growing consideration for users who want to earn passively on their ETH. But should you run your own node or use an exchange-based pool?,0.0772,0.098,0.055,0.847
2021-01-07,The latest research report looks at data and timelines and what they mean for asset prices.,0.3612,0.143,0.0,0.857
2021-01-07,"Ethereum - the largest smart contract platform in the world smashed a new record today by surpassing it's previous All Time High (ATH) market capitalization of $136B. The premier asset is currently trading in a range of $1250-$1270, which gives it a market capitalization of $144B.",0.6369,0.115,0.0,0.885
2021-01-08,"Not many crypto search terms have come close to their peaks in spite of the new bull market, but Ethereum is a notable exception.",-0.296,0.0,0.091,0.909
2021-01-08,"Ethereum traded to a new yearly high at $1,280 before correcting lower against the US Dollar. ETH price declined over $200, but the bulls were active near the 100 hourly simple moving average.",0.4497,0.101,0.046,0.853
2021-01-08,Ethereum (ETH/USD) moderated early in today's North American session as the pair depreciated to the 1224.17 area after trading as high as the 1275.00 area.,0.0,0.0,0.0,1.0
2021-01-08,"Quick Take 1 minute read When it comes to Ethereum, more people are searching for it on Google than they ever have before. According to.",0.0,0.0,0.0,1.0
2021-01-08,"A recent volatile run-up in the Ethereum and Bitcoin markets has exceeded their value into “overbought” regions, as per Relative Strength Indicator (RSI). In retrospect, the RSI is a momentum indicator that measures the magnitude of recent price changes in an asset to determine its overbought or oversold conditions.",0.7964,0.155,0.0,0.845
2021-01-08,"After a minor downside correction, bitcoin price started a fresh increase above USD 38,500. BTC surged over 8% and reclaimed the USD 40,000 level. It is currently (13:00 UTC) trading well above USD 40,000 and it could continue to rise towards USD 42,000 and USD 42,500. Besides, most major altcoins are recovering and rising. ETH/USD is back above USD 1,200 and it seems like it could even test USD",0.7351,0.126,0.027,0.847
2021-01-08,"Although ETH's price still falls short of painting a new ATH, over 99% of all Ethereum addresses are in profit, which is a 2-year record.",0.4404,0.116,0.0,0.884
2021-01-08,"The 2021 alt season may have kicked off with Ethereum's high OI. Currently, the open interest in Ethereum is higher than $3.5 Billion.",0.4588,0.12,0.0,0.88
2021-01-08,"Ethereum showed a bearish divergence and was forced to pull back to $1150 on its attempt to climb past $1300, but further gains can be expected for Ether. Tron saw steady demand from buyers that will likely help in further driving the rally, while Basic Attention Token also looked poised for a break out above […]",0.7506,0.148,0.061,0.792
2021-01-08,"Bitcoin After a substantial 44% price surge this week, Bitcoin continued to set new ATH prices today at $42,000. The cryptocurrency started the year off underneath the $30,000 level after a strong performance in December 2020.",0.6249,0.137,0.0,0.863
2021-01-08,With the launch of every new blockchain comes a new block explorer website to understand.,-0.4404,0.0,0.182,0.818
2021-01-08,"Polkadot failed to break out of a bullish pattern and was headed back down toward the $9 mark, and could see a move as far south as $8 if Bitcoin or Ethereum experience some volatility. Monero rebounded strongly off the $130 support level and was knocking on the doors of $150 with intent.",0.128,0.086,0.059,0.856
2021-01-08,"Traders are buying every dip and pushing Bitcoin price to new highs on a daily basis, triggering many altcoins to follow suit.",0.0,0.0,0.0,1.0
2021-01-08,"The volume for Ethereum futures reached $257.06 billion in December, according to data compiled by The Block. The post December saw the highest monthly volume for Ethereum futures to date appeared first on The Block.",-0.6597,0.036,0.148,0.816
2021-01-08,"Ethereum and the entire crypto market is consolidating today following some recent turbulence Bulls stepped up after the entire market saw a massive selloff yesterday and absorbed the influx of selling pressure, allowing BTC to rocket past $40,000 and ETH to move higher Today, the market has consolidated and drifted slightly lower, although bulls still […]",-0.4779,0.0,0.072,0.928
2021-01-09,Ethereum defended the $1150 level of support on its recent dip and looked likely to head further higher as it gathered steam for its next move. EOS formed a descending triangle in a shorter timeframe and could see a breakout to retest the $3.35 level of resistance.,0.4019,0.059,0.0,0.941
2021-01-09,Ethereum has undergone a remarkable rally over the past seven days. The post Macro investor says Ethereum price growth looks similar to Bitcoin's in 2016-2017 appeared first on CryptoSlate.,0.7351,0.193,0.0,0.807
2021-01-09,"  Ethereum's First Rally The first significant rally for ETH ran from Aug. 2015 to Jun. 2016. During that time, ETH rose from a low of $0.50 to a high of $21.49, which amounted to an increase of 4200%.",0.25,0.105,0.054,0.842
2021-01-09,Ethereum (ETH/USD) extended recent gains early in today's North American session as the pair appreciated to the 1240.59 area after trading as low as the.,0.5574,0.191,0.07,0.738
